"","business_id","name","address","City","State","postal_code","latitude","longitude","stars","review_count","is_open","categories","compliment_count","Business.Status","Special Category"
"1037","fSl9CIn1sUbdrAl98zmjxw","Panera Bread","18011 Highwoods Preserve Pkwy","Tampa","FL","33647",28.1310904438,-82.365935,3,64,1,"Breakfast & Brunch, Soup, Bagels, Sandwiches, Food, Salad, Restaurants",0,"Open","Salad"
"1038","PRsj49qMOyW9fbztKrRglg","PDQ Carrollwood","12650 N Dale Mabry Hwy","Tampa","FL","33618",28.06176,-82.504486,3.5,143,1,"Sandwiches, Chicken Shop, Fast Food, Cafes, Restaurants, Salad",0,"Open","Salad"
"1039","bzJA43cyMpRu9LYYi5j2JA","Chicken Salad Chick","4050 W Kennedy","Tampa","FL","33609",27.9444579597,-82.5117603837,4.5,67,1,"Sandwiches, Southern, Salad, Restaurants, Chicken Shop",0,"Open","Salad"
"1040","ylx88ivUufB2TfxgB_0JZw","Pazza Bistro","7210 US Hwy 19 N","Pinellas Park","FL","33781",27.836703,-82.686269,4,74,0,"Italian, Salad, Pizza, Restaurants",0,"Close","Salad"
"1041","H2kssNtOlU2nQM8ymXZ6Pg","Fuzzy's Taco Shop","10240 Big Bend Rd","Riverview","FL","33578",27.7928672174,-82.3408821197,3,86,1,"Salad, Mexican, Tacos, Breakfast & Brunch, Restaurants, Tex-Mex",0,"Open","Salad"
"1042","T3Bbtht3jO2izyO6f6W8bg","Tiki Docks River Bar & Grill","10708 Palmetto St","Riverview","FL","33569",27.8680262749,-82.326116,3.5,281,1,"Tiki Bars, Restaurants, Salad, Nightlife, Bars",0,"Open","Salad"
"1043","4CmLe8tGT5fIYHOaAsb3-g","California Pizza Kitchen at International Plaza","2223 N West Shore Blvd, Space 189","Tampa","FL","33607",27.963903,-82.521648,4,206,1,"Restaurants, American (New), Pizza, Salad, American (Traditional)",0,"Open","Salad"
"1044","bdigj7o0gGh-tqKMwI4HgQ","Fratello's Pizzeria","459 Athens St","Tarpon Springs","FL","34689",28.1539873,-82.7602814,4,10,0,"Italian, American (Traditional), Specialty Food, Food, Chicken Wings, Pizza, Pasta Shops, Sicilian, Restaurants, Salad, Food Delivery Services",0,"Close","Salad"
"1045","CSjudQBe5v7rlEsO7GpabQ","Little Greek Fresh Grill","2701 Forest Rd","Spring Hill","FL","34606",28.473152,-82.6149049,4,35,0,"Restaurants, Greek, Soup, Salad",0,"Close","Salad"
"1046","_mdDAxk-O96OP35XdEfUTA","La Perrada Colombiana","7803 N Armenia Ave","Tampa","FL","33604",28.018547,-82.484047,2,91,1,"Restaurants, Salad, Spanish",0,"Open","Salad"
"1047","dvEJZV3yNrmIONeu-9Sq6g","Zaxby's Chicken Fingers & Buffalo Wings","4201 W Hillsborough Ave","Tampa","FL","33614",27.9966142,-82.5139748,3,41,1,"American (Traditional), Chicken Wings, Salad, Fast Food, Restaurants",0,"Open","Salad"
"1048","uwVsjotoIE21G78LKwLXDA","Oronzo Italian","18027 Highwoods Preserve Pkwy","Tampa","FL","33647",28.1302388,-82.3677341,4.5,110,1,"Salad, Soup, Italian, Restaurants, Pizza",0,"Open","Salad"
"1049","DzWrkEsp7E16WVW7X1Bqbg","Burger Theory","11310 N 30th St","Tampa","FL","33612",28.0517735,-82.4269645,3.5,36,1,"Burgers, Restaurants, Bars, Sports Bars, Beer, Wine & Spirits, Nightlife, Salad, Food",0,"Open","Salad"
"1050","OWZvM6hrLciRv2VwZOS3uw","TOSS - Salads & Wraps","600 1st Ave N","Saint Petersburg","FL","33701",27.7718244,-82.6421406,4.5,15,1,"Salad, Wraps, Restaurants",0,"Open","Salad"
"1051","-K1tIJOQ9bjNCelVN7aWxQ","Tiki Docks Skyway Bar + Grill","3769 50th Ave S","Saint Petersburg","FL","33711",27.72247884,-82.68248885,3.5,160,1,"Tiki Bars, Salad, Bars, Nightlife, Restaurants",0,"Open","Salad"
"1052","Bii6sQO2QNinBq9vdakNBg","Texas de Brazil","4112 West Boy Scout Blvd","Tampa","FL","33607",27.9652404764,-82.5126939571,3.5,640,1,"Event Planning & Services, Restaurants, Brazilian, Salad, Steakhouses, Venues & Event Spaces, Gluten-Free",0,"Open","Salad"
"1053","K_p6iM7M7oVH09uQ_RxKWA","Panera Bread","701 S Howard Ave, Ste 104","Tampa","FL","33606",27.9372314124,-82.4833845069,3,87,1,"Bagels, Breakfast & Brunch, Soup, Salad, Bakeries, Sandwiches, Food, Restaurants",0,"Open","Salad"
"1054","wIiAO9IHsLEPQ1BVI2RJug","Dolce Speakeasy & Supperclub","1343 Cleveland St","Clearwater","FL","33755",27.9653166,-82.7812282,4,61,0,"Restaurants, American (New), Desserts, Beer Bar, Nightlife, American (Traditional), Food, Salad, Bars",0,"Close","Salad"
"1055","JIo1b0tAwoMQxbjvBXc_zw","Blaze Pizza","3194 Word Way, The Village at Mitchell Ranch","Trinity","FL","34655",28.204458,-82.666625,4,49,1,"Pizza, Salad, Restaurants, Fast Food",0,"Open","Salad"
"1056","uQaXrr2sCyCD8dt-RdFrhg","Greenroots Cafe","1000 Channelside Dr","Tampa","FL","33602",27.9489189,-82.4458666,4,21,0,"Acai Bowls, Restaurants, Salad, Specialty Food, Drugstores, Shopping, Mexican, Juice Bars & Smoothies, Tacos, Fruits & Veggies, Health & Medical, Food, Pharmacy",0,"Close","Salad"
"1057","f6SUVg7CYKT8sdU_CRMGZg","Mity Nice Cafe","5944 Benjamin Rd","Tampa","FL","33634",28.0013231,-82.5423739,3.5,18,1,"Sandwiches, Breakfast & Brunch, Food Delivery Services, Delis, Restaurants, Caterers, Salad, Event Planning & Services, Food",0,"Open","Salad"
"1058","Rs4NR4-H9F9-x1a3CZnaoA","Deck Pizza","2202 W Platt St","Tampa","FL","33606",27.941727,-82.482249,3.5,34,0,"Salad, Chicken Wings, Pizza, Restaurants",0,"Close","Salad"
"1059","cFoUuE6thjn88cVCTqYBHw","Johnny's Italian Restaurant","2907 State Road 590, Ste 1","Clearwater","FL","33759",27.9822,-82.7167155,3.5,218,1,"Italian, Desserts, Food, Salad, Restaurants",0,"Open","Salad"
"1060","fTXSAVnzPkHqCzA4l6896g","Chicken Salad Chick","2790 E Fowler Ave, Ste 490","Tampa","FL","33612",28.0553985034,-82.4273366597,4.5,177,1,"Sandwiches, Salad, Delis, Southern, Diners, Restaurants, Chicken Shop, Cafes",0,"Open","Salad"
"1061","_I5upW_pN1Xjs9xs_1jMEg","Waffle House","3009 W Columbus Dr","Tampa","FL","33607",27.9669244,-82.4920375,4,26,1,"Salad, Restaurants, American (Traditional), Sandwiches, Breakfast & Brunch, Diners, Waffles",0,"Open","Salad"
"1062","oeD6OiItgca6A66Odak6nA","Mr Empanada","17693 N Dale Mabry Hwy","Lutz","FL","33548",28.1267375523,-82.5019324619,4,41,1,"Fast Food, Ethnic Food, Latin American, Empanadas, Italian, Specialty Food, Food, Spanish, Soup, Restaurants, Salad",0,"Open","Salad"
"1063","Z7fw-YKQTHiNZqu_Vw10Pg","Tampa Salad Company","200 N Tampa St","Tampa","FL","33602",27.946144,-82.458664,2,7,0,"Restaurants, Salad",0,"Close","Salad"
"1064","uX31y8tMkt918miAJaSIgQ","Panera Bread","2285 Ulmerton Rd","Clearwater","FL","33762",27.894467,-82.6648196,3,82,1,"Salad, Coffee & Tea, Bagels, Food, Bakeries, Soup, Sandwiches, Restaurants, Breakfast & Brunch",0,"Open","Salad"
"1065","J1XdgoK5-wabYDTGKAIzCQ","Joey Brooklyn's Famous Pizza Kitchen","210 1st Ave N","Saint Petersburg","FL","33701",27.771945,-82.6358835,4,272,1,"Sandwiches, Pizza, Restaurants, Salad",0,"Open","Salad"
"1066","bBKR4pH312WAum3IZ32d4Q","PDQ St. Petersburg","4526 4th St N","Saint Petersburg","FL","33703",27.813624,-82.6391229,4,151,1,"Fast Food, American (Traditional), Chicken Wings, Salad, Sandwiches, American (New), Food, Chicken Shop, Restaurants",0,"Open","Salad"
"1067","3gXgILE2YWVidJDvVWBT6Q","Central Park Family Restaurant","7657 State Rd 54","New Port Richey","FL","34653",28.2176518,-82.6873044,4,196,1,"Restaurants, Greek, Salad, American (Traditional), Breakfast & Brunch",0,"Open","Salad"
"1068","QNci5FL13duF0a-nf9sGWQ","Village Inn Restaurant","2525 Gulf-To-Bay Blvd","Clearwater","FL","34619",27.9599762,-82.7331548,3,81,1,"Restaurants, Food, Breakfast & Brunch, Salad, Burgers, Desserts, American (Traditional)",0,"Open","Salad"
"1069","ADIGOsz22XwJZZIMCLIWJw","Burger Monger","1325 4th St N","St Petersburg","FL","33701",27.7854417799,-82.6383284257,4,186,1,"Restaurants, Desserts, Hot Dogs, Food, Burgers, Chicken Shop, Salad",0,"Open","Salad"
"1070","4e3WUz7hN1-EwGtTDC5flA","Earl of Sandwich","811 N Tampa St","Tampa","FL","33602",27.9509364,-82.4600883,3.5,22,0,"Restaurants, Wraps, Sandwiches, Salad",0,"Close","Salad"
"1071","HEwuI1O_okr9OzjRw255oQ","Chicken Salad Chick","965 E Bloomingdale Ave","Brandon","FL","33511",27.8928225987,-82.2713391617,4,41,1,"Food, Chicken Shop, Southern, Bakeries, Salad, Sandwiches, Soup, Restaurants",0,"Open","Salad"
"1072","L5x8FH4G7mvYIEGjvLhUCA","PDQ Clearwater","2181 Gulf To Bay Blvd","Clearwater","FL","33765",27.9590939,-82.7465562,3.5,85,1,"Salad, Chicken Shop, Fast Food, Restaurants, Sandwiches",0,"Open","Salad"
"1073","1wy8va7aZ7eXXCIVGajYhw","Potbelly Sandwich Shop","4100 George J Bean Pkwy, Tampa Intl. Airport, Tampa Intl Airport","Tampa","FL","33607",27.9751298905,-82.53224,3,25,1,"Soup, Restaurants, Sandwiches, Fast Food, Breakfast & Brunch, Salad",0,"Open","Salad"
"1074","So5ynsJSVB1qaDek1oXvXg","Tibby's New Orleans Kitchen","1721 W Brandon Blvd","Brandon","FL","33511",27.9370899,-82.3113325,4,650,1,"Desserts, Salad, Cajun/Creole, Food, Restaurants",0,"Open","Salad"
"1075","IgjKXg7jnoUqb5H2MqCR7w","Luv Fresh","17503 Preserve Walk Ln, Ste B","Tampa","FL","33647",28.1280482,-82.3694399,4.5,11,1,"Restaurants, Juice Bars & Smoothies, Acai Bowls, American (New), Food, Salad",0,"Open","Salad"
"1076","vb-xBIlGWHCsFrJeXFfnuA","Squeeze Juice Works","675 30th Ave N","Saint Petersburg","FL","33704",27.7996285,-82.6421617,4,35,1,"Juice Bars & Smoothies, Food, Coffee & Tea, Restaurants, Salad",0,"Open","Salad"
"1077","j0ib7Ketxwsz_9F__DYWFQ","Antonio's Pizzeria","2805 38th Ave N","St Petersburg","FL","33713",27.8066957686,-82.6715975944,3.5,292,0,"Pizza, Italian, Event Planning & Services, Salad, Cheesesteaks, Sandwiches, Caterers, Restaurants",0,"Close","Salad"
"1078","KX2WxEYtBIrepYD7MOQqqQ","Pinocchio's Pizza","811 S Pinellas Ave","Tarpon Springs","FL","34689",28.1400076,-82.741122,3.5,48,0,"Pizza, Food, Restaurants, Salad, Italian, Desserts",0,"Close","Salad"
"1079","sVWJORAa2XoVmuOahZoZUg","Olive Garden Italian Restaurant","9690 US Highway 19","Port Richey","FL","34668",28.2983224555,-82.7056297978,3,94,1,"Italian, Restaurants, Salad, Bars, Nightlife, Wine Bars, Soup",0,"Open","Salad"
"1080","1Dm8yPX4_9JRONf1HRHt5w","Your Mother's Back Yard","10555 66th St N","Pinellas Park","FL","33782",27.8676416,-82.7282655,4.5,46,1,"Salad, Restaurants, Sandwiches, Soup",0,"Open","Salad"
"1081","W1liYt9f11Y4U5wi3XTZpA","The Country Cuban","13763 County Rd 672","Wimauma","FL","33598",27.7630476633,-82.2490871698,5,6,1,"Salad, Delis, Sandwiches, Restaurants",0,"Open","Salad"
"1082","PY45-qxjIqvC9-jbRqmEfg","The Club House Restaurant","10801 Starkey Rd, Ste 24","Seminole","FL","33777",27.870721,-82.7604,4.5,50,1,"Restaurants, American (Traditional), Salad, Sandwiches",0,"Open","Salad"
"1083","a6HKcQXYY2N6-VLsHHDttA","Poppa's BBQ","4890 122nd Ave N","Clearwater","FL","33762",27.8823334,-82.6995975,4.5,95,1,"Salad, Sandwiches, Barbeque, Restaurants",0,"Open","Salad"
"1084","xfsXGjtRcXyydgmUmfgKWQ","New York New York Pizza","533 S Howard Ave","Tampa","FL","33606",27.9396713,-82.4834192,3.5,224,1,"Restaurants, Pizza, Food, American (Traditional), Chicken Wings, Salad, Italian, Soup",0,"Open","Salad"
"1085","L9Chf9h-zu8kwbAdJTUtFg","Oya Sushi","10525 Park Blvd, Ste 111","Seminole","FL","33772",27.8399203,-82.785048,4,60,1,"Salad, Restaurants, Korean, Sushi Bars",0,"Open","Salad"
"1086","XZweIXAOyAYEvwZbtw8dgA","Thai Town","1342 Main St","Dunedin","FL","34698",28.0198143,-82.7699591,4,144,1,"Salad, Noodles, Restaurants, Thai, Food, Desserts",0,"Open","Salad"
"1087","1ooWNKz7_sEOhVJYoiY8FA","Willie Jewell's Old School Bar-B-Q","12004 Anderson Rd","Tampa","FL","33625",28.0591234476,-82.5438344707,3.5,98,1,"Restaurants, Barbeque, Sandwiches, Southern, Salad",0,"Open","Salad"
"1088","yJbjrrphcm_gek_dM7p1OA","Sofia's Greek Grill","1446 Belcher Rd S","Clearwater","FL","33764",27.943739,-82.746418,4.5,116,1,"Burgers, Salad, Greek, Restaurants",0,"Open","Salad"
"1089","SvcuRSVWAgrd4YKMghJE2A","Olive Garden Italian Restaurant","10500 Ulmerton Rd, Ste 470","Largo","FL","33771",27.8942056419,-82.7858140435,3.5,104,1,"Italian, Restaurants, Salad, Soup, Wine Bars, Nightlife, Bars",0,"Open","Salad"
"1090","ayrKCuN81UEUduBhZJycXQ","La' Berry Frozen Yogurt & Ice-cream Cafe","20304 Trout Creek Dr","Tampa","FL","33647",28.1634054,-82.3543038,4,41,0,"Salad, Food, Cafes, Ice Cream & Frozen Yogurt, Juice Bars & Smoothies, Restaurants, Sandwiches",0,"Close","Salad"
"1091","GBtCFp9EU0Ti86ftGewZZg","Your Pie - Brandon","125 E Bloomingdale Ave","Brandon","FL","33511",27.8928659,-82.2841386,4.5,66,1,"Pasta Shops, Specialty Food, Food, Salad, Pizza, Restaurants",0,"Open","Salad"
"1092","CbUhPPCH04V668zECkZlJg","Olive Garden Italian Restaurant","6700 Hwy 19","Pinellas Park","FL","33781",27.8333169,-82.681056,3,98,1,"Italian, Restaurants, Bars, Salad, Nightlife, Soup, Wine Bars",0,"Open","Salad"
"1093","eVcwfXRvMXlB_lr2On86gQ","Uncle Fat's Tavern","8745 Temple Terrace Hwy","Temple Terrace","FL","33637",28.0308105,-82.3555534,4,54,1,"Restaurants, Nightlife, Salad, Bars, Sandwiches, Pubs, Burgers",0,"Open","Salad"
"1094","MoGdRI5ZTDr-Hg2lubA4LA","Jo Jo’s Italian Diner","217 S Pinellas Ave","Tarpon Springs","FL","34689",28.1446656555,-82.7564997768,4.5,47,1,"Italian, Soup, Salad, Restaurants",0,"Open","Salad"
"1095","d4cZaMZvzQdyqHar5766SQ","Brewburgers","3681 S Westshore Blvd","Tampa","FL","33629",27.909047,-82.527015,2.5,20,0,"Chicken Wings, Salad, Restaurants, Burgers",0,"Close","Salad"
"1096","9582WUc5l40_vQUWDLKxOA","Clementine Chef","","Tampa","FL","33604",28.0165404,-82.4590282,4.5,34,1,"Salad, Gluten-Free, Sandwiches, Food, Restaurants, Food Delivery Services, Bakeries",0,"Open","Salad"
"1097","PPK-i_5Eftv2wBCnmsqgug","Karma Juice Bar & Eatery","2095 Drew St, Unit B","Clearwater","FL","33765",27.9676201,-82.7507944,4.5,102,1,"Salad, Juice Bars & Smoothies, American (New), Restaurants, Acai Bowls, Food",0,"Open","Salad"
"1098","NlU_lOXB20c5dSC1QV4U4A","Oasis Deli & Market","201 N Franklin St, Hilton hotel 2nd level walkway","Tampa","FL","33602",27.9467155674,-82.4569775443,4,10,0,"Grocery, Wraps, Breakfast & Brunch, Delis, Restaurants, Salad, Cafes, Food, Sandwiches",0,"Close","Salad"
"1099","mq4iu4S3FDvX-z59hGzpqA","Havana Harry's Market &  Cafe","14219 Walsingham Rd, Ste A","Largo","FL","33774",27.8808246609,-82.834875114,4,64,1,"Food, Cafes, Soup, Salad, Desserts, Cuban, Restaurants",0,"Open","Salad"
"1100","nAFlaqJwr3RspnWlnFxy7g","The Wild Iris Café","434 Virginia Ln","Dunedin","FL","34698",28.0124261,-82.7871039,4.5,32,1,"Salad, Restaurants, Cafes, Burgers",0,"Open","Salad"
"1101","OD6RYPrU2QTyTg6_4GYpbA","Brandon Pizzeria","140 N Parsons Ave","Brandon","FL","33510",27.9392063,-82.2860844,3.5,147,0,"Salad, Pizza, Restaurants, Italian",0,"Close","Salad"
"1102","R4NUjB9RLfaZr2OcFfxB2Q","Perdigon El Sabor","8548 N Dale Mabry Hwy, Ste 1A","Tampa","FL","33614",28.0286692,-82.5057506,4,162,1,"Restaurants, Filipino, Mexican, Steakhouses, Tacos, Salad, Venezuelan, Latin American",0,"Open","Salad"
"1103","4hwmCBtmeMmB3UYeSewdPA","Sunset Grill","2328 Sunset Point Rd","Clearwater","FL","33765",27.9901447,-82.7406881,4,185,1,"American (Traditional), Nightlife, Restaurants, Bars, Breakfast & Brunch, Salad, Sandwiches",0,"Open","Salad"
"1104","9I3pqS1gTmVX5Hmu5KKU1g","Inside the Box Café","1715 N Westshore Blvd","Tampa","FL","33607",27.9574376,-82.5236391,4.5,59,0,"Cafes, Caterers, Desserts, Sandwiches, Bakeries, Event Planning & Services, Food, Restaurants, Salad, Soup",0,"Close","Salad"
"1105","ymAuIcQlbQtcR2RDinkKUA","Frappe Xscape","5101 E Busch Blvd, Ste 7","Tampa","FL","33617",28.0320833,-82.3986956,4,14,0,"Cuban, Food, Restaurants, Salad, Wraps, Latin American, Sandwiches, Juice Bars & Smoothies",0,"Close","Salad"
"1106","XzgFo5jFPBgeZedVWpwL1g","All Wrapped Up","17471 Gulf Blvd","Redington Shores","FL","33708",27.8235511,-82.8276474,4.5,45,0,"Ice Cream & Frozen Yogurt, Restaurants, Food, Salad, Cafes, Sandwiches",0,"Close","Salad"
"1107","519hm725XtfGaK_7bT7aYw","Wanh's Thai To Go","10500 Ulmerton Rd, Ste 756","Largo","FL","33771",27.8928357,-82.78347,4.5,30,0,"Thai, Salad, Restaurants, Noodles",0,"Close","Salad"
"1108","eIVfVLwxUXd3GKbPUvljqQ","Toast Wine & Cafe","14921 Bruce B Downs Blvd","Tampa","FL","33613",28.0822703,-82.4137794,4,28,0,"Wine Bars, Cafes, Nightlife, Restaurants, Bars, Salad, Tapas Bars, Sandwiches",0,"Close","Salad"
"1109","nmfAvn4lOsVqDmYI8zBiPQ","Juice Market","109 N Kings Ave","Brandon","FL","33510",27.9387955286,-82.2936891,3.5,5,1,"Food, Juice Bars & Smoothies, Wraps, Restaurants, Salad",0,"Open","Salad"
"1110","y37pP-WTmusgdWBCWAZftg","Caruso's Pizza NY Style","8216 State Rd 52","Hudson","FL","34667",28.3292683061,-82.6786872042,3.5,20,0,"Chicken Wings, Salad, Restaurants, Pizza",0,"Close","Salad"
"1111","I2_0af3Gu4SyAq4Qdz5cFg","Original Westshore Pizza South Tampa","4802 W Bay Ct Ave","Tampa","FL","33611",27.9071222,-82.5270814,3,175,1,"Restaurants, Pizza, Sandwiches, American (Traditional), Salad",0,"Open","Salad"
"1112","j8gq5zpB70_-SpN_zBOBpg","Rogue Sandwich","2284 Commercial Way","Spring Hill","FL","34606",28.4651488,-82.6194872,4.5,11,0,"Pizza, Salad, Bagels, Sandwiches, Food, Restaurants",0,"Close","Salad"
"1113","bjQrmBSu1A7f5vprEikOKA","Healthy N Fresh Cafe","3648 Henderson Blvd","Tampa","FL","33609",27.9361062,-82.5028742,5,238,1,"Salad, Food, Juice Bars & Smoothies, Restaurants, Sandwiches",0,"Open","Salad"
"1114","FuwM02obw0PhqNdZVE6ugg","The Wooden Rooster","104 2nd Ave NE","St Petersburg","FL","33701",27.7733518,-82.6336852,4,425,1,"Food, Breakfast & Brunch, Coffee & Tea, Creperies, Sandwiches, Restaurants, Salad",0,"Open","Salad"
"1115","RMYjaB5krFGCtlOLf5TBwQ","German Knodle","951 Central Ave","Saint Petersburg","FL","33706",27.7713384,-82.6479855,5,193,1,"German, Food, Cafes, Juice Bars & Smoothies, Restaurants, Salad, Sandwiches, Burgers",0,"Open","Salad"
"1116","VtiZZRMTTokVZXsfVO3BZQ","Joto's Pizza Pub","8080 49th St N","Pinellas Park","FL","33781",27.8455235,-82.7004197,4,27,1,"Restaurants, Pizza, Salad, Food, Desserts",0,"Open","Salad"
"1117","79WxyT3xjXV6MFMmgaU7Yw","Massimos Pizza Subs and Salads","6146 N US Highway 41","Apollo Beach","FL","33572",27.7669263842,-82.3951015994,4,114,0,"Food, Restaurants, Sandwiches, Bakeries, Salad, Ethnic Food, Specialty Food, Italian, Pizza",0,"Close","Salad"
"1118","M-oi_kkI0AhbR-xqR5yrNA","Jimbo's Pit Bar B-Q - Tampa","4103 W Kennedy Blvd","Tampa","FL","33609",27.9451443753,-82.5122690797,3.5,267,1,"Event Planning & Services, Salad, Sandwiches, Restaurants, Caterers, Barbeque",0,"Open","Salad"
"1119","1bzQnwSL3EsGqADWiPDF6A","Capital Tacos","6765 Land O' Lakes Blvd","Land O' Lakes","FL","34638",28.2559115912,-82.4734526095,4.5,611,1,"Restaurants, Tacos, Food, Tex-Mex, Salad, Food Trucks, Mexican",0,"Open","Salad"
"1120","K-iaKQlCoJzCBAy5qngkCw","Thai Bistro","2602 E Fletcher Ave, Ste 105","Tampa","FL","33612",28.0696389,-82.4301272,4,108,1,"Thai, Food, Restaurants, Ethnic Food, Specialty Food, Salad, Soup, Noodles",0,"Open","Salad"
"1121","OTjS4wcvaabAzpfkwVzwxw","PDQ Test Kitchen","4343 Anchor Plaza Pkwy, Ste 100","Tampa","FL","33634",27.981075,-82.547939,4,28,1,"Sandwiches, Restaurants, American (Traditional), Pizza, Delis, Salad, Fast Food, Burgers",0,"Open","Salad"
"1122","3nuDjIVfclE99gf4KBidKw","Little Greek Fresh Grill - Westshore","165 Westshore Plz, Fl 6","Tampa","FL","33609",27.946853,-82.527423,3,26,0,"Greek, Salad, Food, Restaurants",0,"Close","Salad"
"1123","FRYUPVYt9n7sBUGPfri2GA","Panera Bread","40968 US Highway 19 N","Tarpon Springs","FL","34689",28.1454294,-82.7427837,2.5,46,1,"Sandwiches, Food, Bagels, Soup, Restaurants, Bakeries, Salad, Breakfast & Brunch",0,"Open","Salad"
"1124","KERdRePXa_V7NugZiBmwJQ","Bob Evans","12272 Morris Bridge Rd","Temple Terrace","FL","33637",28.0683663417,-82.3580498993,3.5,69,1,"Comfort Food, Hotels & Travel, Bed & Breakfast, Restaurants, American (Traditional), Salad, Breakfast & Brunch",0,"Open","Salad"
"1125","M9s1QoMF8AHqsB9j58bKtA","Ellie's Breakfast & Lunch","12008 Race Track Rd","Tampa","FL","33626",28.060797,-82.644471,4,119,1,"Breakfast & Brunch, Restaurants, Diners, Salad",0,"Open","Salad"
"1126","AA3PVJe09RLNAu6rb-iDLw","Panera Bread","10500 Ulmerton Rd","Largo","FL","33771",27.8941237,-82.7808997,3,25,1,"Bagels, Bakeries, Soup, Food, Salad, Breakfast & Brunch, Restaurants, Sandwiches",0,"Open","Salad"
"1127","eOI9IHud6hpd_sXN99OT6w","Seminole Subs & Gyros","11599 66th St","Largo","FL","33773",27.8775214,-82.7285395,4,47,1,"Restaurants, Salad, Sandwiches",0,"Open","Salad"
"1128","0kMb6sceumXggycSLJlpmA","Culver's","12538 State Rd 54","Odessa","FL","33556",28.1909790039,-82.6107711792,3.5,36,1,"Salad, Restaurants, Fast Food, Ice Cream & Frozen Yogurt, Sandwiches, Burgers, Food",0,"Open","Salad"
"1129","iI2qa1u8pkCwHfNUsDgUvg","Squeeze Juice Works","18 22nd St S","St Petersburg","FL","33712",27.7705183,-82.66292,3.5,14,1,"Food, Juice Bars & Smoothies, Health Markets, Restaurants, Specialty Food, Salad",0,"Open","Salad"
"1130","_yIbTW0sD9kfkLt-QuN9uw","Panera Bread","23388 State Rd 54, Ste 107","Lutz","FL","33549",28.1854042244,-82.429134138,2.5,84,1,"Restaurants, Sandwiches, Salad, Soup",0,"Open","Salad"
"1131","M393O-w38Ml_WucZke0K-Q","Formaggio's at Riverhills","4356 Lithia Pinecrest Rd","Lithia","FL","33596",27.8763674,-82.2241004,4,40,1,"Italian, Salad, Pizza, Restaurants",0,"Open","Salad"
"1132","y-Ook7IVvOhJYON2ztX5ZA","Cicis","1560 North Mcmullen Booth Rd","Clearwater","FL","33759",27.9817246,-82.7112366,2.5,58,1,"Food, Salad, Restaurants, Pizza, Desserts",0,"Open","Salad"
"1133","UiOi9XByHTu1o9C-rFTrOw","CoreLife Eatery","13149 N Dale Mabry Hwy, Ste B","Tampa","FL","33618",28.0660629,-82.5018964,3.5,72,0,"Restaurants, Food, Poke, Barbeque, Gluten-Free, Salad, Korean, Acai Bowls",0,"Close","Salad"
"1134","NrmcBZSjxvOPucWkY8dkHQ","Loaded","1901 Drew St","Clearwater","FL","33765",27.9677383,-82.7586375,5,23,1,"Food, Salad, Comfort Food, Chicken Wings, American (Traditional), Restaurants, Desserts",0,"Open","Salad"
"1135","Ay9nthqEaLUCQOd8zs67bw","Bob Evans","11720 Tampa Gateway Blvd","Seffner","FL","33584",28.008560078,-82.3017468282,3.5,45,1,"American (Traditional), Salad, Restaurants, Bed & Breakfast, American (New), Diners, Food, Hotels & Travel, Breakfast & Brunch, Comfort Food",0,"Open","Salad"
"1136","EGfGwQ6VPSlnm_g3KTa1Dg","New York New York Pizza","11203 Sheldon Rd","Tampa","FL","33626",28.051616,-82.582015,3.5,98,1,"Pizza, Restaurants, Salad, Burgers",0,"Open","Salad"
"1137","pGM44vXYa6lke-dU4h-xpA","Olive Garden Italian Restaurant","2801 E Busch Blvd","Tampa","FL","33612",28.032223841,-82.4281075539,3,112,1,"Bars, Italian, Sandwiches, Restaurants, Wine Bars, Soup, Salad, Nightlife",0,"Open","Salad"
"1138","1qTX8_QGGmtLP1JvOuAxfg","Panera Bread","1403 Commercial Way","Spring Hill","FL","34607",28.4550154,-82.6305285,3,49,1,"Food, Breakfast & Brunch, Salad, Sandwiches, Bagels, Soup, Restaurants",0,"Open","Salad"
"1139","kkAyWX3toco_aLk0nNM-3A","Villa Rina Pizza","10073 E Adamo Dr","Tampa","FL","33619",27.9419481,-82.3378595,4,73,1,"Restaurants, Pizza, Gluten-Free, Cheesesteaks, Sandwiches, Salad",0,"Open","Salad"
"1140","9P7hxwVKjYS4C-EkPlvZMw","Madison Avenue Pizza","2660 Bayshore Blvd","Dunedin","FL","34698",28.0506806347,-82.7803384875,4,154,1,"Pizza, Restaurants, Salad, Italian",0,"Open","Salad"
"1141","jJYjNEI8o2q1S9k89ndRTg","Rosati's Pizza","3437 Lithia Pinecrest Rd","Valrico","FL","33596",27.8924643625,-82.2418701107,3.5,91,1,"Chicken Wings, Salad, Restaurants, Sandwiches, Pizza",0,"Open","Salad"
"1142","_dyh3uCE6E4TimbtFiB-ag","10 & 10 Enoteca","2223 N Westshore Blvd, Unit B217","Tampa","FL","33607",27.9654632859,-82.5209096288,5,32,1,"Salad, Wine Bars, Bars, Nightlife, Food, Restaurants, Desserts, Tapas/Small Plates, Specialty Food",0,"Open","Salad"
"1143","FvBLSErZi9ScAIB7uCIj1Q","Pizza Toro","5509 E Fowler Ave","Temple Terrace","FL","33617",28.0534450884,-82.3943623509,4,42,0,"Food, Desserts, Restaurants, Salad, Pizza",0,"Close","Salad"
"1144","K4ogLNLcwYNnwulNW8ikSg","E & E Stakeout Grill","100 Indian Rocks Rd N, Ste 100","Belleair Bluffs","FL","33770",27.9179601,-82.8171014,4,298,1,"Restaurants, Nightlife, American (Traditional), American (New), Salad, Steakhouses, Cocktail Bars, Bars",0,"Open","Salad"
"1145","eQPX1bLy7UA7aFvZHwkfPQ","EVOS Feel Great Food-St. Petersburg","2631 4th St N","St Petersburg","FL","33704",27.7963615,-82.63811,3.5,153,1,"Restaurants, Burgers, American (New), Food, Salad, American (Traditional), Fast Food, Organic Stores",0,"Open","Salad"
"1146","v1h5pa9k21vMLA2a_UCthg","Rizzoli's Pizza","2340 State Road 580","Clearwater","FL","33763",28.020139,-82.740368,4,100,1,"Pizza, Salad, Chicken Wings, Sandwiches, Italian, Restaurants",0,"Open","Salad"
"1147","7EqJePBl_QA2ZpS-PQqFCw","Camilleon Cookies & Salads","5337 Gunn Hwy","Tampa","FL","33624",28.0594953197,-82.534021932,5,8,0,"American (Traditional), Sandwiches, Food, Restaurants, Salad, Bakeries",0,"Close","Salad"
"1148","RY3SwE3MjUCM_1c6zrNkNA","Hungry Harry's Famous Bar-B-Que","2006 S Parsons Ave","Seffner","FL","33584",27.9788551,-82.2855272,4,153,1,"Food, Restaurants, Desserts, Sandwiches, Salad, Barbeque",0,"Open","Salad"
"1149","hsU84UpInlNdejDpp-wNKQ","Bavaro's Pizza Napoletana & Pastaria","945 Central Ave","Saint Petersburg","FL","33705",27.7713316,-82.6478657,4,277,1,"Pizza, Restaurants, Salad, Italian",0,"Open","Salad"
"1150","BQdozsc8akK4rbbFQTtflg","Bob Evans","16314 N Dale Mabry Hwy","Tampa","FL","33618",28.1024314276,-82.5030333549,3,64,1,"Comfort Food, Hotels & Travel, Salad, Bed & Breakfast, Breakfast & Brunch, American (Traditional), Restaurants",0,"Open","Salad"
"1151","j7ncqwcEZiJAACnMrUlrLg","Katana Japanese Express","10839 Bloomingdale Ave","Riverview","FL","33578",27.89204,-82.3205551,4.5,22,1,"Teppanyaki, Salad, Japanese, Restaurants, Sushi Bars",0,"Open","Salad"
"1152","gUlLB3z16E5BI4Q6pNO-AA","Panera Bread","10801 Starkey Rd, Ste 16","Largo","FL","33777",27.8717067,-82.7605474,3.5,24,1,"Soup, Bagels, Food, Salad, Restaurants, Sandwiches, Breakfast & Brunch",0,"Open","Salad"
"1153","YlAI0sW0bsVsvErTnfXoHQ","Famous Sal's Pizza & Italian Eatery","14190 US Highway 19","Hudson","FL","34667",28.363417,-82.69205,4,69,1,"Italian, Sandwiches, Steakhouses, Restaurants, Pizza, Salad",0,"Open","Salad"
