"","business_id","name","address","City","State","postal_code","latitude","longitude","stars","review_count","is_open","categories","compliment_count","Business.Status","Special Category"
"700","_AvzLKrrs1cIWP343tfjvg","Sims Smoked Barbecue & Seafood","6010 County Rd 579","Seffner","FL","33584",28.0024129,-82.3027713129,4.5,77,1,"Chicken Wings, Food, Restaurants, Food Trucks, Barbeque, Seafood, American (New)",0,"Open","Seafood"
"701","ftvJpV1dX9a_pd0e72nB5g","Poké Falls","6800 Gulfport Blvd S, Unit 217","South Pasadena","FL","33707",27.7569135408,-82.7334152182,4.5,32,1,"Food, Poke, Hawaiian, Restaurants, Seafood",0,"Open","Seafood"
"702","GzeXHLLVCD24cfJUNv0d_w","Sea Critters Cafe","2007 Pass-A-Grille Way","St Pete Beach","FL","33706",27.6970991,-82.7354517,4,637,1,"Nightlife, Bars, Seafood, Local Flavor, Sandwiches, Restaurants",0,"Open","Seafood"
"703","GAGvDs8lW5wkD5Fwt8C3sg","Don Pancho","6803 N Armenia Ave","Tampa","FL","33604",28.009897,-82.484013,4.5,16,1,"Mexican, Tacos, Seafood, Restaurants",0,"Open","Seafood"
"704","iEVFxjWlkCUiDmIWE0poRQ","Mi Bello Ecuador Restaurante","4820 N Armenia Ave","Tampa","FL","33603",27.989877,-82.4848895,3.5,21,0,"Seafood, Restaurants, Latin American",0,"Close","Seafood"
"705","vpVuIbx6ddyTMomMJTcsvQ","Southern Fry","1524 E Fowler Ave","Tampa","FL","33612",28.0552463,-82.4415282022,4,9,1,"American (Traditional), American (New), Seafood, Restaurants, Fast Food, Southern",0,"Open","Seafood"
"706","ZRwBqPLrO5Yf4ToXeijQ8Q","Windmill Natural Cafe And Taphouse","11401 N 56th St, Ste 22","Temple Terrace","FL","33617",28.052154,-82.393027,3.5,27,0,"Breakfast & Brunch, Seafood, American (Traditional), Restaurants, Vegan",0,"Close","Seafood"
"707","XHT8dPGL83ZybXqb_XZmTg","Fish Tales","1500 2nd St S","Saint Petersburg","FL","33701",27.7556094,-82.6351468,3,110,0,"Bars, Seafood, Steakhouses, Nightlife, Restaurants, Dive Bars",0,"Close","Seafood"
"708","JeO8XimR_a79kSoFkmNfUw","Yianni's Cafe and Grill","514 Dodecanese Blvd","Tarpon Springs","FL","34689",28.1555923,-82.7588636,3,175,1,"Seafood, Greek, Restaurants",0,"Open","Seafood"
"709","3TpSuWBTfoHyALIePVpNXw","Crabby's On The Pass","12754 Kingfish Dr","Treasure Island","FL","33706",27.782413,-82.781687,4,86,1,"Seafood, Restaurants, American (Traditional), Pizza, Breakfast & Brunch",0,"Open","Seafood"
"710","McYtxSrd0HQ07nsc3X65WQ","Rumba Island Bar & Grill","3687 Tampa Rd","Oldsmar","FL","34677",28.045303,-82.6813469,4,244,0,"Bars, Seafood, Caribbean, American (Traditional), Nightlife, Barbeque, Restaurants",0,"Close","Seafood"
"711","HVNjKqwNTp3ccFmHGo4DxA","New ABC Seafood Restaurant","1441 E Ave, Ste 107","Tampa","FL","33612",28.0689982943,-82.4442359485,4,40,0,"Restaurants, Dim Sum, Chinese, Cantonese, Seafood",0,"Close","Seafood"
"712","5RAj-6dwjudECuuj14GdnA","O'Maddy's Bar & Grille","5405 Shore Blvd S","St Petersburg","FL","33707",27.737883,-82.706758,4,459,1,"Seafood, Nightlife, American (New), Karaoke, Restaurants",0,"Open","Seafood"
"713","InS2FvXYgG1cm4CRWlWzYw","Spinners Rooftop Grille","5250 Gulf Blvd","St. Pete Beach","FL","33706",27.7260128125,-82.7428213393,3.5,292,1,"Hotels & Travel, Lounges, Nightlife, Event Planning & Services, Hotels, Bars, Steakhouses, Restaurants, Seafood",0,"Open","Seafood"
"714","O1-mV4N5z7rTvmEaZbkD8A","Ricky P's Po Boys Shop","6521 4th St N","St Petersburg","FL","33702",27.8320372,-82.6385844,4.5,45,0,"Sandwiches, Seafood, Restaurants, Cajun/Creole",0,"Close","Seafood"
"715","N8vvl_dRa0R9ooJqWFJ4GQ","Bonefish Grill","1015 Providence Rd","Brandon","FL","33511",27.9220038,-82.3179405,4,231,1,"Restaurants, Seafood, American (New), Bars, Cocktail Bars, Nightlife",0,"Open","Seafood"
"716","Vpv7_M6dpg92GwappohXlw","Rome + Fig","317 N Rome Ave","Tampa","FL","33606",27.9474275,-82.476623,4.5,156,1,"Seafood, Restaurants, Chicken Wings, Breakfast & Brunch, Diners, American (New)",0,"Open","Seafood"
"717","DE7oNZUBOkAQ4zhA8tZQLg","Crabby Bill's Off The Hook","9648 W Linebaugh Ave","Tampa","FL","33626",28.0431792757,-82.5932304701,3.5,171,0,"Sandwiches, Salad, Nightlife, Cocktail Bars, Seafood, Cajun/Creole, Restaurants, Bars",0,"Close","Seafood"
"718","EhnIoWqdRIGZ3S2_i2WJ5Q","The Crab House International","4406 N Cortez Ave","Tampa Florida","FL","33614",27.9821687,-82.508759,3.5,41,1,"Seafood, Restaurants",0,"Open","Seafood"
"719","BY-du320SIHBR9MYUrZSZg","Keegan's Seafood Grille","1519 Gulf Blvd","Indian Rocks Beach","FL","33785",27.8986647,-82.8478654,4,787,1,"American (Traditional), Restaurants, American (New), Seafood",0,"Open","Seafood"
"720","naR0-fib3LmYnxxVP9nNXQ","Bj's asian fusion","883 S Pinellas Ave","Tarpon Springs","FL","34689",28.1390972,-82.7553836,3.5,119,1,"Sushi Bars, Asian Fusion, Chinese, Restaurants, Seafood, Thai",0,"Open","Seafood"
"721","eJxNnmDHBzYfxD5lFiifJw","Shaner's Land & Sea Market","2000 Pass A Grille Way","St. Pete Beach","FL","33706",27.6966743,-82.7360418,4,60,1,"Specialty Food, Restaurants, Food, Seafood, Seafood Markets, Meat Shops",0,"Open","Seafood"
"722","Uooe_7n4jy1ZYAFF0xe2UA","City Fish Grill","4022 Tampa Rd","Oldsmar","FL","34677",28.035485,-82.654868,3.5,204,0,"American (New), Caribbean, Salad, Restaurants, Steakhouses, Seafood",0,"Close","Seafood"
"723","0InojtGES0EuD3hfXGoeow","Alma","111 Boardwark Pl W, Ste 201","Madeira Beach","FL","33708",27.785247,-82.782107,4,38,0,"Tapas Bars, American (New), Mediterranean, Seafood, Restaurants",0,"Close","Seafood"
"724","qBa7eCuZrepejZbUE-yp9g","Davidson's Dockside","527 Anclote Rd, Ste 210","Tarpon Springs","FL","34689",28.162327,-82.769867,4,232,0,"American (Traditional), Restaurants, Breakfast & Brunch, Seafood",0,"Close","Seafood"
"725","biGIDbCGsAZJ-Y4zyV_b_A","Taza Mediterranean Grill","1076 East Brandon Blvd","Brandon","FL","33511",27.940439,-82.266787,4.5,65,0,"Vegan, Restaurants, Wraps, Mediterranean, Salad, Middle Eastern",0,"Close","Vegan"
"726","QNxXsVPYcecUuhGRG-88OQ","Harvest Bowl Eatery & Market","6109 N Florida Ave","Tampa","FL","33604",28.002703,-82.4590917,4,101,1,"Wraps, American (New), Vegan, Breakfast & Brunch, Restaurants",0,"Open","Vegan"
"727","C1QkJ4s_p3hMTrvOgM7ssA","The Enerjuicer","3309 W Kennedy Blvd","Tampa","FL","33629",27.9451157,-82.4978944,3.5,122,1,"Juice Bars & Smoothies, Active Life, Fitness & Instruction, Burgers, Acai Bowls, Food, Vegan, Salad, Specialty Food, Restaurants, Yoga, Health Markets",0,"Open","Vegan"
"728","3OGzmGqWwsyGLkhnxrA9Pw","Gourmet Pizza Company","610 S Armenia Ave, Ste 101","Tampa","FL","33609",27.937948,-82.484684,4,185,1,"Pizza, Restaurants, Gluten-Free, Vegan",0,"Open","Vegan"
"729","yJqN-U9dUylYEwTr8SBP1Q","Grain and Berry","12953 US-301, Unit 103","Riverview","FL","33578",27.799635,-82.335347,3.5,43,1,"Vegan, Restaurants, Juice Bars & Smoothies, Acai Bowls, Food",0,"Open","Vegan"
"730","NRnP0BVwVeSFQRhWXRTGWg","Grain and Berry","2446 4th St N","Saint Petersburg","FL","33704",27.794445,-82.6388244,5,28,1,"Juice Bars & Smoothies, Restaurants, Vegan, Food, Acai Bowls",0,"Open","Vegan"
"731","1Efad30BdOeqqjX2d6P4sw","Ohana Cafe","306 Orange St N","Palm Harbor","FL","34683",28.0690372,-82.775979,4,99,0,"Vegan, Asian Fusion, Cafes, Vegetarian, Restaurants, Gluten-Free, Hawaiian",1,"Close","Vegan"
"732","EP2jFD3aGoSBCWb7irY5-w","Queen of Sheba","11001 N 56th St","Temple Terrace","FL","33617",28.048786,-82.3927705,4,361,1,"Ethiopian, Restaurants, Vegan, Vegetarian",0,"Open","Vegan"
"733","Mda0PLZBaHyyBGii30NVcQ","India's Grill Brandon - Authentic Indian Cuisine","902 E Brandon Blvd Brandon","Brandon","FL","33511",27.9381235,-82.2710117,4.5,47,1,"Indian, Vegan, Restaurants, Vegetarian",0,"Open","Vegan"
"734","MxR4ADMrdNWAjNAMA_zXZA","Naan Boti & Chai Shai","908 22nd St S","Saint Petersburg","FL","33712",27.76091,-82.6627542,4,22,1,"Food Delivery Services, Food, Vegan, Pakistani, Indian, Restaurants",0,"Open","Vegan"
"735","WOh7JO3TfcpfhCfjuDzXVA","The Green Table Restaurant","3390 Tampa Rd","Palm Harbor","FL","34684",28.066822,-82.7229768,4.5,82,1,"Restaurants, Vegetarian, Vegan",0,"Open","Vegan"
"736","ew_Hhp12Silh3qjoPaW9IA","Thai Legacy Restaurant","120 N Parsons Ave","Brandon","FL","33510",27.9387182,-82.2860935,4.5,203,1,"Food, Thai, Restaurants, Desserts, Vegan",0,"Open","Vegan"
"737","tavK8PX3ysc8DRFEB8AlTA","Quality Foods Market","16307 N Florida Ave","Lutz","FL","33549",28.1024492,-82.4600226,4.5,32,1,"Salad, Grocery, Specialty Food, Delis, Food, Beer, Wine & Spirits, Beer Bar, Nightlife, Vegan, Sandwiches, Bars, Pizza, Wine Bars, Desserts, Restaurants",0,"Open","Vegan"
"738","ZiQiMlvgk19GrEEkN9kyRA","The Blind Tiger Cafe - Ybor City","1901 E 7th Ave","Tampa","FL","33605",27.9601407,-82.4378181,4.5,331,1,"Shopping, Vegan, Vegetarian, Beer, Wine & Spirits, Sandwiches, Food, Bagels, Bakeries, Coffee & Tea, Men's Clothing, American (Traditional), Restaurants, Women's Clothing, Breakfast & Brunch, Acai Bowls, Fashion, Cafes",0,"Open","Vegan"
"739","B7nlRFe3EeQwAWpUpefGHA","Provisions Coffee & Kitchen","5862 Goldview Pkwy","Wesley Chapel","FL","33544",28.2418295018,-82.3519144186,4.5,261,1,"Bakeries, Coffee & Tea, Bars, Donuts, Beer Bar, Food, Bubble Tea, Restaurants, Nightlife, Breakfast & Brunch, Gluten-Free, Vegan, Cafes, Acai Bowls",0,"Open","Vegan"
"740","E9-zXaqJGg97ZqgX_tydTw","Hello Sunshine Cafe","212 E Tarpon Ave","Tarpon Springs","FL","34689",28.1471054443,-82.7546182385,4.5,7,0,"Restaurants, Cafes, Vegan",0,"Close","Vegan"
"741","xT41eqUSsM_MDE1Vjhq20A","SoFresh","533 S Howard Ave, Unit 8","Tampa","FL","33606",27.9396220218,-82.4834168043,4.5,306,1,"Gluten-Free, Food, American (Traditional), Wraps, Vegan, Juice Bars & Smoothies, Salad, American (New), Restaurants",0,"Open","Vegan"
"742","JzitabC4iyw3BC1D6SFy8Q","Greenstock","449 Central Ave N","Saint Petersburg","FL","33701",27.77134,-82.63947,4,18,0,"Vegan, Restaurants, Salad, Food",0,"Close","Vegan"
"743","rq8_Zif-NVsExWFQWXg3tA","Oh Yeah Creamery","224 S Blvd","Tampa","FL","33606",27.9419238219,-82.4684761577,4.5,17,1,"Vegan, Restaurants, Ice Cream & Frozen Yogurt, Food",0,"Open","Vegan"
"744","vLT1DBDuJpchewphXR6i0Q","Fresh Bites","11665 Countryway Blvd","Tampa","FL","33626",28.069518,-82.6304221,4.5,305,1,"Salad, Mediterranean, Middle Eastern, Organic Stores, Food, Lebanese, Restaurants, Vegan, Arabic",0,"Open","Vegan"
"745","6_Gsn1ZxSosWb6mZusap0Q","Sweet Soul","1101 S Howard Ave","Tampa","FL","33606",27.9325705,-82.483258,4.5,198,1,"Restaurants, Ice Cream & Frozen Yogurt, Acai Bowls, Vegan, Food, Juice Bars & Smoothies",0,"Open","Vegan"
"746","cYUuOZzzTBrKz49OPNNUsw","Farmacy Vegan Kitchen & Bakery","5212 Bridge St, Bldg D, Unit 108","Tampa","FL","33611",27.8904486,-82.5295022,4,5,1,"Vegan, Restaurants, Food, Bakeries",0,"Open","Vegan"
"747","DWvUksyr2wlNiEu0MfYLuA","Ozona Pizza","404 Orange St","Palm Harbor","FL","34683",28.0705747,-82.7759921,3.5,123,1,"Restaurants, Pizza, Vegan, Desserts, Food, Gluten-Free",0,"Open","Vegan"
"748","rv1KUBVNQkJ5WUQb49dU0Q","Golden Dinosaurs","2930 Beach Blvd S","Gulfport","FL","33707",27.7403761,-82.7075618,4.5,158,1,"Coffee & Tea, Pubs, Delis, Food, Vegan, Cuban, Restaurants, Bars, Nightlife",0,"Open","Vegan"
"749","WvPIOVr2dcUXcTWoloFmTw","Pizza Fusion","9556 W Linebaugh Ave","Tampa","FL","33626",28.0436679,-82.5909373,4,60,0,"Food, Specialty Food, Gluten-Free, Vegan, Pizza, Restaurants",0,"Close","Vegan"
"750","s4nlPf6kXz97uk0yerqmHg","Vegg'd Out Vegan Kitchen","","Tampa","FL","33618",28.0557869,-82.5040054,5,12,1,"Vegetarian, Juice Bars & Smoothies, Organic Stores, Food Delivery Services, Restaurants, Vegan, Caterers, Desserts, Food Stands, Event Planning & Services, Food, Pop-up Shops, Shopping, Cafes",0,"Open","Vegan"
"751","mjqsJ6qZjnY77hCi41Xudg","Grain and Berry - New Tampa","8638 Hunters Village Rd","Tampa","FL","33647",28.139999803,-82.3575468852,4.5,34,1,"Restaurants, Acai Bowls, Juice Bars & Smoothies, Food, Vegan",0,"Open","Vegan"
"752","m61MRBD5w9udzeJQIWe7oQ","SOHO Juice Company","3120 W Bay To Bay Blvd","Tampa","FL","33629",27.9195496,-82.4950812,4.5,18,0,"Acai Bowls, Juice Bars & Smoothies, Food, Vegan, Restaurants",0,"Close","Vegan"
"753","fuO0FFnL5sHWgnLl5neJNg","Tasty Roots","218 E Davis Blvd","Tampa","FL","33606",27.9269000221,-82.4538533762,4,12,0,"Organic Stores, Food, Vegan, Restaurants",0,"Close","Vegan"
"754","G_U3rVuzCVgYqSmk35mbSQ","Vida de Cafe","120 8th Ave","Saint Pete Beach","FL","33706",27.6879638,-82.7375779,4.5,82,0,"Restaurants, Vegan, Vegetarian, Live/Raw Food",0,"Close","Vegan"
"755","WUCm48LSSxeN3mZknFK7Wg","Plant Love Ice Cream","953 Central Ave","Saint Petersburg","FL","33705",27.7713117,-82.6479817,5,134,1,"Desserts, Food, Ice Cream & Frozen Yogurt, Restaurants, Vegan",0,"Open","Vegan"
"756","3pTFz8RH9AZ9JoeWfGqXHg","Raw Smoothie - SOG","6102 S Macdill Ave","Tampa","FL","33611",27.879846,-82.4936063,3.5,6,1,"Vegan, Acai Bowls, Restaurants, Food, Juice Bars & Smoothies, Organic Stores",0,"Open","Vegan"
"757","N_KCIzBrdP5J3EcLFc2Aag","Fit Bowl","214 E Davis Blvd","Tampa","FL","33606",27.9270636,-82.4538991,5,17,1,"Food, Pop-up Shops, Acai Bowls, Juice Bars & Smoothies, Shopping, Vegan, Restaurants",0,"Open","Vegan"
"758","q2o9Byux2frVX9EtuP7qmw","SoFresh","2774-A East Fowler Ave","Tampa","FL","33612",28.0556385,-82.4274875,4.5,304,1,"American (Traditional), Food, Vegetarian, Salad, Juice Bars & Smoothies, Restaurants, Wraps, Vegan, Gluten-Free, American (New)",0,"Open","Vegan"
"759","ftn9PVzDo1yLsRzPYZ8Dow","Green Culture","1420 Seven Springs Blvd","Trinity","FL","34655",28.1796,-82.6972708,4.5,63,1,"Food, Specialty Food, Acai Bowls, Restaurants, Breakfast & Brunch, Fruits & Veggies, Vegan, Coffee & Tea, Juice Bars & Smoothies",0,"Open","Vegan"
"760","b6oPUMzsh_CvJohpK5iVXA","Fresh Factory","7350 Gulf Blvd","St Pete Beach","FL","33706",27.74114167,-82.75109833,4,43,1,"Juice Bars & Smoothies, Restaurants, Vegan, Salad, Food, Acai Bowls",0,"Open","Vegan"
"761","Oo2QSeBVkx8HJQm8SIL1Fg","Mellow Mushroom","11955 Sheldon Rd","Tampa","FL","33626",28.0574104,-82.5821657,4,303,0,"Salad, Nightlife, Restaurants, Pizza, Sandwiches, Vegan, Bars, Food, Beer, Wine & Spirits",0,"Close","Vegan"
"762","NBjZWsD9C-JwjsQ2mQlmNg","Ohana Cafe","1452 Main St","Dunedin","FL","34698",28.019877,-82.765302,4.5,260,1,"Restaurants, Sandwiches, Wraps, American (New), Burgers, Asian Fusion, Breakfast & Brunch, Diners, Cafes, Gluten-Free, Vegetarian, Hawaiian, Vegan",1,"Open","Vegan"
"763","GV1s2EOQX7tLQrDjPGUJUQ","Community Cafe","2444 Central Ave","Saint Petersburg","FL","33712",27.7709672,-82.6666912,4.5,114,0,"Vegan, Cafes, Sandwiches, Vegetarian, Restaurants",0,"Close","Vegan"
"764","AHLQulzMieUxdvpSQwYL4A","Bamboozle Channelside","109 N 12th St","Tampa","FL","33602",27.9486025833,-82.4465710398,4,198,1,"Vegan, Food, Vietnamese, Coffee & Tea, Restaurants, Asian Fusion, Bubble Tea",0,"Open","Vegan"
"765","Ydu9tZPmGV31A2wgsLhyPA","Dosahut","10029 W Hillsborough Ave","Tampa","FL","33615",28.004385,-82.596582,4,99,0,"Vegetarian, Restaurants, Indian, Vegan",0,"Close","Vegan"
"766","9oFpaCMYYsgyDAtA0YdMng","Lucy's Vegan Corner","2462 Central Ave","Saint Petersburg","FL","33712",27.770864922,-82.6669182818,5,33,0,"Food, Vegan, Restaurants, Food Delivery Services, Bakeries",0,"Close","Vegan"
"767","G4LfkfTS9JM97rsEP3Bn9A","Mangia Gourmet","2930 Beach Blvd S","Gulfport","FL","33707",27.740406,-82.707433,4.5,66,0,"Gluten-Free, Vegetarian, Juice Bars & Smoothies, Food, Vegan, Restaurants",0,"Close","Vegan"
"768","nVVyZOyB3u605pdUtG5NTA","Grain and Berry","1155 S Dale Mabry Hwy","Tampa","FL","33629",27.9324458774,-82.5070745308,4,78,1,"Vegan, Food, Restaurants, Acai Bowls, Juice Bars & Smoothies",0,"Open","Vegan"
"769","CneZ4q2u_tPsPTuXdL-FHg","I Love Cupcakes","13220 Belcher Rd","Largo","FL","33773",27.8929494882,-82.7466201782,3.5,33,0,"Food, Vegan, Event Planning & Services, Caterers, Restaurants, Bakeries, Desserts, Gluten-Free, Cupcakes",0,"Close","Vegan"
"770","DUE7xjBzDV2rrp2ArjcWLQ","A-Green Oriental Market","1321 E Fletcher Ave","Tampa","FL","33612",28.0686501,-82.445243,4,7,1,"Ethnic Food, Grocery, Restaurants, Imported Food, Food, Specialty Food, Vegan",0,"Open","Vegan"
"771","4bvQThX0cJxlx67PU9nmLQ","Leafy Greens Cafe","1626 Central Ave","Saint Petersburg","FL","33712",27.7708615624,-82.6555204405,4,280,0,"Soup, Gluten-Free, Breakfast & Brunch, Vegetarian, Vegan, Restaurants",0,"Close","Vegan"
"772","7YHHmCZl8Nx6OV0kgqCZ_A","Valhalla Bakery","2462 Central Ave","Saint Petersburg","FL","33712",27.77077,-82.666916,4.5,88,1,"Sandwiches, Vegan, Bakeries, Food, Desserts, Restaurants",0,"Open","Vegan"
"773","Yqq632XNaCNNT9aBhNcdqA","Consciousness Blossoms","3390 Tampa Rd","Palm Harbor","FL","34684",28.066822,-82.7229768,4.5,86,0,"American (New), Diners, Breakfast & Brunch, Restaurants, Salad, Vegan, Vegetarian, Gluten-Free, Sandwiches",0,"Close","Vegan"
"774","IpoUu-oHFFN8S9A1iUY2XA","Poke Falls - Brandon","2102 W Brandon Blvd","Brandon","FL","33511",27.938554,-82.3187779,4.5,80,1,"Vegan, Asian Fusion, Hawaiian, Restaurants",0,"Open","Vegan"
"775","8cvkk0HB-F2Irctug1h3SA","Doormét","1155 S Dale Mabry Hwy, Ste 12","Tampa","FL","33629",27.9326175,-82.5063215,4.5,190,1,"Vegan, Gluten-Free, Burgers, Restaurants, American (New), Cafes, Pizza, American (Traditional)",0,"Open","Vegan"
"776","-zGlHyBaxib9p7k18i5TSA","Organic Goddess Cafe","1219 Florida Ave","Palm Harbor","FL","34683",28.0782015549,-82.7645599786,4.5,23,0,"Organic Stores, Restaurants, Food, Active Life, Yoga, Vegetarian, Fitness & Instruction, Vegan, Cafes, Dance Studios, Juice Bars & Smoothies",0,"Close","Vegan"
"777","GVLPzKS9AMOyVBHq0DYiGg","Joes Farm Fresh Produce Market","3780 Tampa Rd","Oldsmar","FL","34677",28.042315,-82.677194,4.5,51,1,"Farmers Market, Food, Specialty Food, Delis, Fruits & Veggies, Restaurants, Vegan, Grocery, Organic Stores, International Grocery",0,"Open","Vegan"
"778","Ve5zx8XJN60-ohKUOGwQJg","Dharma Southern Kitchen","1910 N Ola Ave","Tampa","FL","33602",27.9611064,-82.4640636,4.5,168,1,"Vegetarian, Vegan, Restaurants, Southern",0,"Open","Vegan"
"779","56AIvAU0yxOfVKPGwONjuA","Kodawari Cafe","3965 S Henderson Blvd","Tampa","FL","33629",27.9313428,-82.5095353,4,8,1,"Juice Bars & Smoothies, Coffee & Tea, Cafes, Vegan, Food, Restaurants, Specialty Food, Pizza",0,"Open","Vegan"
"780","mgpCGxAMyHmyeGKorXefvg","Trader Joe's","2742 4th St N","Saint Petersburg","FL","33704",27.7974016,-82.6388275,4.5,131,1,"Beer, Wine & Spirits, Florists, Grocery, Vegan, Flowers & Gifts, Kosher, Restaurants, Specialty Food, Shopping, Food",0,"Open","Vegan"
"781","y17Jaips_raLiJNavrNb9g","Dunn Baked","2340 State Road 580","Clearwater","FL","33763",28.0200209,-82.7406565,5,10,1,"Restaurants, Food, Vegan, Bakeries, Desserts",0,"Open","Vegan"
"782","QU3cET055Ewld3x_bxEtqw","The Blind Tiger Cafe - Seminole Heights","4304 N Florida Ave","Tampa","FL","33604",27.984719,-82.45965,4.5,73,1,"American (Traditional), Sandwiches, Vegetarian, Coffee & Tea, Vegan, Restaurants, Desserts, Cafes, Patisserie/Cake Shop, Bagels, Bakeries, Food",0,"Open","Vegan"
"783","1E3PYHrVVqR6D_bYt49Lhg","The Cider Press","3118 3rd Ave N","St Petersburg","FL","33713",27.7743967,-82.6758931,4,590,1,"Waffles, Bars, Wine Bars, American (Traditional), Vegan, Restaurants, Gastropubs, Nightlife, Vegetarian, Beer Bar",0,"Open","Vegan"
"784","mDTJ6OVTQhBk6b_wK32YfA","Taco Bus","505 S Gulfview Blvd","Clearwater","FL","33767",27.9682448516,-82.8284020112,4,168,1,"Restaurants, Tacos, Vegan, Mexican, Food, Empanadas, Vegetarian, Desserts, Food Trucks",0,"Open","Vegan"
"785","Tf8KLsWjf24FiGcZh6FD-Q","Rawk Star Cafe","4011 Tampa Rd, Ste 11","Oldsmar","FL","34677",28.0375497,-82.6581055,5,168,1,"Vegan, Juice Bars & Smoothies, Food, Gluten-Free, Restaurants",0,"Open","Vegan"
"786","B7YZGbFkgo6TmnqLwaHQhw","Bubbakoo's Burritos","1701 S Alexander St","Plant City","FL","33566",27.9992145,-82.1386382,3.5,14,1,"Mexican, Restaurants, Vegan, Chicken Wings, Vegetarian, New Mexican Cuisine",0,"Open","Vegan"
"787","FxJKgdvzwdkYXO2apXBcNA","SOHO Juice Co.","2200 4th St N","Saint Petersburg","FL","33704",27.7922927,-82.6388803,4,137,1,"Juice Bars & Smoothies, Restaurants, Food, Vegetarian, Acai Bowls, Vegan, Salad, Live/Raw Food",0,"Open","Vegan"
"788","YC0y5wGsy4nA17CRJieQSw","Grill Fresh","2485 Nebraska Ave","Palm Harbor","FL","34683",28.0793464,-82.7402633,4,52,1,"Desserts, Food, Acai Bowls, Specialty Food, Vegan, Health Markets, Restaurants",0,"Open","Vegan"
"789","BmiVxeMfn3VDQsLt2ALofw","Dunedin Vegan Deli","2340 Main St","Clearwater","FL","33763",28.0198643,-82.7402772,4.5,64,1,"Vegan, Delis, Vegetarian, Pizza, Restaurants",0,"Open","Vegan"
"790","CwbqhvNJj6C4J2kV2np51Q","HaleLife Bakery","3351 Tech Dr N, Ste 13","Clearwater","FL","33762",27.8926677,-82.678766,4.5,83,1,"Gluten-Free, Bakeries, Restaurants, Food, Vegan",0,"Open","Vegan"
"791","YgppXEDVZvx9i02ExwN48Q","Pieology Pizzeria","11165 Park Blvd N","Seminole","FL","33772",27.84103943,-82.79376172,4,102,1,"Vegan, Fast Food, Restaurants, Pizza, Gluten-Free",0,"Open","Vegan"
"792","_58WfMGlrmnPossd2Gps6g","Black Radish Grocer","2923 N 12th St","Tampa","FL","33605",27.9704312,-82.4468718,5,17,1,"Vegan, Restaurants, Organic Stores, Specialty Food, Food, Grocery",0,"Open","Vegan"
"793","2GgFrz1dQ6NzR29UIYQ8Xg","Neighborhood Joe","2609 Dr Mlk Jr St N","Saint Petersburg","FL","33704",27.7959993,-82.6465446,4.5,81,1,"Vegan, Food, Coffee & Tea, Restaurants, Sandwiches, Kombucha, Breakfast & Brunch",0,"Open","Vegan"
"794","MUQGkZQqPx5dpM6yhajkDQ","Sweet Elizabeth's Organics","","Lutz","FL","33548",28.1340975,-82.4806907,5,21,0,"Bakeries, Food, Coffee & Tea, Waffles, Vegan, Gluten-Free, Desserts, Restaurants",0,"Close","Vegan"
"795","WxW50gAkatN0OtCPZD664Q","Love Food Central","2057 Central Ave","Saint Petersburg","FL","33713",27.771337,-82.661389,4.5,253,1,"Gluten-Free, Restaurants, Comfort Food, Vegetarian, Vegan",0,"Open","Vegan"
"796","pqi8jMdzeYifbQfAnZfj1w","Sylvia's Waffles","2152 Drew St","Clearwater","FL","33765",27.9682136,-82.7486082,5,83,0,"Restaurants, Salad, Cafes, Wraps, Belgian, Vegan, Waffles",0,"Close","Vegan"
"797","C1uSyclZTxXgkYimu9LuSg","Revelations Cafe","17808 N Dale Mabry Hwy","Lutz","FL","33548",28.1294111,-82.5033292,4.5,111,1,"Juice Bars & Smoothies, Vegetarian, Vegan, Cafes, Breakfast & Brunch, Restaurants, Food",0,"Open","Vegan"
"798","vMS6aalBPqkf-4vAYEmSHg","Pam's Roti Shop & Caribbean Market","2800 38th Ave N","Saint Petersburg","FL","33713",27.8063572,-82.6716008,4.5,94,1,"Specialty Food, Grocery, Caribbean, Ethnic Food, Food, Indian, Vegan, Meat Shops, International Grocery, Restaurants",0,"Open","Vegan"
"799","OGXeRGntC3VXd7WKUP4JfQ","Mr Mango Tampa","2223 N West Shore Blvd","Tampa","FL","33607",27.963716,-82.520724,4.5,14,1,"Vegetarian, Food, Desserts, Specialty Food, Vegan, Juice Bars & Smoothies, Fruits & Veggies, Restaurants",0,"Open","Vegan"
"800","Kup9m2JnUJrnnULc9zjDQQ","Serendipity Cafe","664 Main St","Dunedin","FL","34698",28.0153284098,-82.7827230811,4,101,0,"Restaurants, Desserts, Cafes, Art Classes, Vegan, Education, Gluten-Free, Breakfast & Brunch, Food",0,"Close","Vegan"
"801","4nr-pXYTCYFZyVEihV2BAw","Farmacy Vegan Kitchen + Bakery","117 N 12th St","Tampa","FL","33602",27.9483459238,-82.4465568171,4,28,1,"Food, Vegan, Bakeries, Breakfast & Brunch, Restaurants, Burgers, Juice Bars & Smoothies",0,"Open","Vegan"
"802","FboNTDVK03ytZFOHl8VPyA","Grass Root","4334 S Manhattan Ave","Tampa","FL","33611",27.9020003,-82.5184251,3.5,25,0,"Vegan, Restaurants, Live/Raw Food, Food, Vegetarian, Juice Bars & Smoothies",0,"Close","Vegan"
"803","A4xadkdNuuwXHiZ8dYdzUA","Good Vibes Juice","200 Main St, Ste 108","Dunedin","FL","34698",28.0121053,-82.7897514,4,33,1,"Vegan, Restaurants, Juice Bars & Smoothies, Food, Acai Bowls",0,"Open","Vegan"
"804","I-lzm4uU2_sjyN92BFRyhg","Old Earth Pure ORGANIC Food","6105 54th Ave N","Saint Petersburg","FL","33709",27.821238,-82.718205,5,12,0,"Salad, Live/Raw Food, Vegan, Health Markets, Juice Bars & Smoothies, Restaurants, Specialty Food, Food",0,"Close","Vegan"
"805","RLRTakpA-jtBsurYHjZRRQ","Trang Viet Cuisine","230 E Bearss Ave","Tampa","FL","33613",28.0894957,-82.4584569,4,213,1,"Restaurants, Vietnamese, Vegan",0,"Open","Vegan"
"806","exuQOZA1tvlZbCiheUs1Eg","Chai Mixology","1106 Central Ave","St Petersburg","FL","33705",27.7709352,-82.6501325,4.5,58,1,"Poke, Bubble Tea, Food, Vegan, Restaurants, Juice Bars & Smoothies, Coffee & Tea",0,"Open","Vegan"
"807","7Hpb9zYXOyTuFpxQksdqfA","Duckweed Urban Grocery","117 N 12th St","Tampa","FL","33602",27.948388,-82.446394,3.5,27,1,"Specialty Food, Health Markets, Beer, Wine & Spirits, Food, Grocery, Bakeries, Vegan, Restaurants",0,"Open","Vegan"
"808","ZlIGD9F_tHvc_AWsOIFdEA","Driftwood Kava & Roastery St. Pete","740 Central Ave","Saint Petersburg","FL","33701",27.7710065,-82.6442601,4,19,1,"Vegan, Coffee Roasteries, Restaurants, Food, Juice Bars & Smoothies",0,"Open","Vegan"
"809","C6cg4Yl7QU-Uzp1RYy5Q0g","The Twisted Indian","1113 Central Ave","Saint Petersburg","FL","33705",27.771358,-82.6504963,4,19,0,"Restaurants, Vegetarian, Indian, Vegan, Mexican",0,"Close","Vegan"
"810","3TyX7yZ1Y9abkEf0qQFFGQ","Taste of Eden Bistro","1107 Lithia Pinecrest Rd","Brandon","FL","33511",27.9210168,-82.2673778,4.5,20,0,"Restaurants, Food, Juice Bars & Smoothies, Vegan, Vegetarian",0,"Close","Vegan"
"811","lPday_z2XpRJqbFWyCh6dw","Taste Safety Harbor","500 Main St","Safety Harbor","FL","34695",27.990724,-82.6925137,3.5,7,0,"Restaurants, Vegan, Delis, Bagels, Music Venues, Desserts, Diners, Food, Local Flavor, Ice Cream & Frozen Yogurt, American (New), Caterers, Middle Eastern, Nightlife, Arts & Entertainment, American (Traditional), Event Planning & Services, Sandwiches, Greek, Vegetarian, Bakeries, Coffee & Tea",0,"Close","Vegan"
"812","L7pOYV4ZS4_uDYYfzzaZGw","Fresh Market of Hyde Park","742 S Village Cir","Tampa","FL","33606",27.9364549,-82.475193,5,21,0,"Local Flavor, Organic Stores, Food, Specialty Food, Fruits & Veggies, Farmers Market, Vegan, Restaurants",0,"Close","Vegan"
